{
    "slug"     : "demo-b1",
    "category" : "building",
    "sizeWDHm" : [80,65,3],
    "vertices" : [
        [0,0],
        [-50,0],
        [-50,-3],
        [-56,-3],
        [-60,0.2],
        [-61,-0.5],
        [-64.5,2.7],
        [-77.6,-10.3],
        [-19.8,-62.8],
        [-17.8,-62.8],
        [0,-53]
    ],
    "center": [-30,-20]
}